{
  "schema": "org.rivermark.benchmark.isaac-runtime-lock.v2",
  "profile_id": "citylite-windows-isaacsim-5.1.0.0-local-isaaclab-2.3.2",
  "python": {
    "implementation": "CPython",
    "version": "3.11.14"
  },
  "host": {
    "system": "Windows",
    "machine": "AMD64",
    "minimum_windows_build": 26100
  },
  "distributions": {
    "isaacsim": "5.1.0.0",
    "isaaclab": "2.3.0",
    "isaaclab-contrib": "0.0.2",
    "numpy": "1.26.0",
    "opencv-python": "4.11.0.86",
    "torch": "2.7.0+cu128",
    "warp-lang": "1.11.1"
  },
  "isaaclab_source": {
    "relative_path": "isaaclab",
    "tree_identity": "88f3f4a9a0d3c7e5",
    "file_count": 438,
    "byte_count": 4587292,
    "version_file": "2.3.2",
    "extension_version": "0.54.3"
  },
  "isaaclab_contrib_source": {
    "relative_path": "isaaclab_contrib",
    "tree_identity": "840bd876a8c106dd",
    "file_count": 27,
    "byte_count": 196665,
    "version_file": "2.3.2",
    "extension_version": "0.0.2"
  },
  "environment_lock": {
    "repository_relative_path": "requirements-isaac-capture.lock",
    "identity": "de55c2f9000001a5"
  },
  "gpu": {
    "vendor": "NVIDIA",
    "minimum_driver_version": "576.80",
    "minimum_vram_bytes": 8589934592
  },
  "launcher": {
    "headless": true,
    "enable_cameras": true,
    "device": "cuda:0",
    "rendering_mode": "balanced",
    "livestream": 0,
    "xr": false,
    "distributed": false,
    "kit_args": "",
    "experience": {
      "path": "apps/isaaclab.python.headless.rendering.kit",
      "identity": "423d5cccc0438bb8"
    }
  },
  "simulation": {
    "device": "cuda:0",
    "dt_s": 0.005,
    "gravity_w_mps2": [
      0.0,
      0.0,
      -9.81
    ],
    "agent_count": 8,
    "render_interval": 1,
    "use_fabric": true,
    "config_digests": {
      "render": {
        "settings": {
          "rendering_mode": "balanced"
        },
        "identity": "8b46cbaa0000001e"
      },
      "fabric": {
        "settings": {
          "enable_scene_query_support": false,
          "use_fabric": true
        },
        "identity": "411ba10c00000037"
      },
      "physx": {
        "settings": {
          "solver_type": 1,
          "solve_articulation_contact_last": false,
          "min_position_iteration_count": 1,
          "max_position_iteration_count": 255,
          "min_velocity_iteration_count": 0,
          "max_velocity_iteration_count": 255,
          "enable_ccd": false,
          "enable_stabilization": false,
          "enable_external_forces_every_iteration": false,
          "enable_enhanced_determinism": false,
          "bounce_threshold_velocity": 0.5,
          "friction_offset_threshold": 0.04,
          "friction_correlation_distance": 0.025,
          "gpu_max_rigid_contact_count": 8388608,
          "gpu_max_rigid_patch_count": 163840,
          "gpu_found_lost_pairs_capacity": 2097152,
          "gpu_found_lost_aggregate_pairs_capacity": 33554432,
          "gpu_total_aggregate_pairs_capacity": 2097152,
          "gpu_collision_stack_size": 67108864,
          "gpu_heap_capacity": 67108864,
          "gpu_temp_buffer_capacity": 16777216,
          "gpu_max_num_partitions": 8,
          "gpu_max_soft_body_contacts": 1048576,
          "gpu_max_particle_contacts": 1048576
        },
        "identity": "9ee109e000000346"
      }
    }
  },
  "assets": {
    "city_lite_contract_identity": "f7837d248b479759",
    "cf2x_usd_identity": "7372ac0786312c47"
  }
}
